pubmed_id,question,actual_answer,actual_result,answer_ordinary,result_ordinary,answer_no_inferred,result_no_inferred
25427406,Are successional changes in the chicken cecal microbiome during 42 days of growth independent of organic acid feed additives?,"Over the 42 d experiment, the cecal bacterial community changed significantly as measured by a variety of ecological metrics and increases in the complexity of co-occurrence networks. Management of poultry to improve animal health, nutrition, or food safety may need to consider the interactive effects of any treatments with the dramatic temporal shifts in the taxonomic composition of the cecal microbiome as described here.",yes,"Maybe. The context indicates that while additives in poultry feed can influence the cecal microbiome and its development, their impact on the overall successional changes during 42 days of growth is not clearly established. The effects of additives on the microbial community as the bird matures remain largely unknown, and some findings suggest that additives have a non-significant impact on certain microbial genera and overall microbiome composition. Therefore, it is uncertain whether the successional changes are independent of organic acid feed additives.",maybe,"Maybe. The context indicates that the effects of organic acid feed additives on the gastrointestinal microbial community in poultry as they mature remain largely unknown, suggesting that it is not definitively established whether successional changes in the chicken cecal microbiome during 42 days of growth are independent of these additives.",maybe
25436452,Does resveratrol enhance palmitate-induced ER stress and apoptosis in cancer cells?,"Our results suggest that RSV exerts its cytotoxic role in cancer cells exposed to a saturated FA context primarily by triglyceride accumulation inhibition, probably leading to an intracellular palmitate accumulation that triggers a lipid-mediated cell death. Additionally, this cell death is promoted by ER stress through a CHOP-mediated apoptotic process and may represent a potential anticancer strategy.",yes,"Maybe. The context indicates that resveratrol (rsv) promotes palmitate-induced lipoapoptosis primarily through an ER stress-dependent mechanism, suggesting it amplifies ER stress and apoptosis in cancer cells treated with palmitate.",maybe,"Yes, resveratrol enhances palmitate-induced ER stress and apoptosis in cancer cells. The context indicates that resveratrol promotes palmitate-induced lipoapoptosis primarily through an ER stress-dependent mechanism, evidenced by increased splicing of xbp1 and elevated expression of chop in palmitate-treated cells.",yes
25443276,Is cDK1 and CDK2 activity a strong predictor of renal cell carcinoma recurrence?,CDK1SA of tumors and the CDK2SA are both associated with recurrence and prognosis.,yes,"Maybe. The context indicates that the activity of cyclin-dependent kinases, specifically cdk1 and cdk2, is associated with prognostic outcomes in renal cell carcinoma, and the ratio of cdk2sa to cdk1sa is used to evaluate risk and predict metastasis. However, it does not explicitly state that cdk1 and cdk2 activity alone are strong predictors of recurrence, but rather that their activities and ratios are important components in risk assessment and prognosis.",maybe,"Maybe. The context indicates that cyclin-dependent kinase 1 (cdk1) activity was evaluated as a prognostic marker in renal cell carcinoma, but it does not specify that cdk1 or cdk2 activity alone are strong predictors of recurrence. Instead, the ratio of cdk2 activity to cdk1 activity was associated with recurrence-free survival, suggesting that the combined activity ratio, rather than cdk1 or cdk2 activity alone, is more relevant for prediction.",maybe
25425302,Is torsion of the optic nerve head a prominent feature of normal-tension glaucoma?,Normal-tension glaucoma eyes had a greater ONH torsion compared to POAG eyes with matched axial length. The direction of the ONH tilt and torsion was related to the location of the visual field defect only in NTG eyes.,yes,"No, torsion of the optic nerve head is not a prominent feature of normal-tension glaucoma. The context indicates that while there is a significant difference in the degree of torsion between normal-tension glaucoma and primary open-angle glaucoma, the degree of horizontal and vertical tilt did not differ significantly between the two groups (p-values of 0.746 and 0.610, respectively). Therefore, torsion is not considered a prominent or defining feature of normal-tension glaucoma.",no,"Maybe. Torsion of the optic nerve head is more prevalent and significantly different in eyes with normal-tension glaucoma, with a higher percentage exhibiting superior torsion and significant differences in torsion degree compared to primary open-angle glaucoma. However, the degree of torsion alone is not described as a prominent feature of normal-tension glaucoma, but it is associated with specific morphological changes in these eyes.",maybe
25433284,Is unrecognized arteriosclerosis associated with wound complications after below-knee amputation?,"After formalization of lower extremity amputation for wet gangrene, traditional markers of PAD were not predictive of wound complications. Although formalization of guillotine BKA can safely be performed without significant delay, more thorough assessment of microvascular disease in the perioperative period may be useful in identifying patients at risk for wound failure.",yes,"Maybe. The context indicates that there was no statistically significant association between wound complications and a history of peripheral arterial disease (which includes arteriosclerosis), with a p-value of 0.4. Since unrecognized arteriosclerosis may not be identified preoperatively, it could be associated with wound complications, but the data does not establish a significant link.",maybe,"No, unrecognized arteriosclerosis is not associated with wound complications after below-knee amputation. The context indicates that there was no statistically significant association between wound complications and a history of peripheral arterial disease (which includes arteriosclerosis), with a p-value of 0.4.",no
25433282,Does hydrogen sulfide reduce inflammation following abdominal aortic occlusion in rats?,Hydrogen sulfide has systemic and renal anti-inflammatory effects in remote IRI following aortic occlusion in rats.,yes,"Maybe. The context indicates that hydrogen sulfide can mediate ischemia-reperfusion injury and is known to lead to inflammation, as well as to mitigate tissue injury in some cases. The study measured inflammatory responses, such as serum tumor necrosis factor alpha levels, and found a significant impact on systemic inflammation (p=0.0038). However, it also states that hydrogen sulfide caused no difference in renal function following aortic occlusion. Therefore, based solely on this information, it is unclear whether hydrogen sulfide reduces inflammation after abdominal aortic occlusion in rats.",maybe,"Maybe. The context indicates that hydrogen sulfide is a mediator of ischemia-reperfusion injury and can reduce tissue injury in many organ systems, suggesting a potential anti-inflammatory effect. However, the role of hydrogen sulfide in vascular surgery, including its specific effect on inflammation following abdominal aortic occlusion in rats, has not yet been established.",maybe
25428612,Is actinic keratosis with atypical basal cells ( AK I ) the most common lesion associated with invasive squamous cell carcinoma of the skin?,"Direct invasion from proliferating basaloid atypical keratinocytes limited to the epidermal basal layer (AK I), known as the differentiated pathway, was the most common form of progression to cutaneous iSCC in our series. On the other hand, stepwise progression from AK I to AK II and AK III (classic pathway) was seen to be operative in a substantial proportion of iSCC cases. All AK lesions, irrespective of intraepidermal neoplasia thickness, are therefore potentially invasive and tumour advance along adnexal structures might facilitate iSCC development from AK I lesions.",yes,"No, actinic keratosis with atypical basal cells (AK I) is not the most common lesion associated with invasive squamous cell carcinoma of the skin. The context indicates that actinic keratosis type i lesions overlying invasive squamous cell carcinoma were present in 63.8% of cases, making it the most prevalent type among the studied cases, whereas AK I is associated with a different pathway and is less frequently linked directly to invasive carcinoma.",no,"Maybe. The context indicates that actinic keratosis type i lesions, which involve atypical basal cells, are present in 77.9% of cases adjacent to invasive squamous cell carcinoma and are associated with proliferative actinic keratosis. Additionally, actinic keratosis type i is described as potentially arising directly from atypical basal cell proliferation, suggesting it is a common lesion related to invasive squamous cell carcinoma.",maybe
25443761,Does high-intensity intermittent exercise increase pulmonary interstitial edema at altitude but not at simulated altitude?,HIIE led to an increase in B-lines at altitude after subacute exposure but not during acute exposure at equivalent simulated altitude. This may indicate pulmonary interstitial edema.,yes,"Yes, high-intensity intermittent exercise increases pulmonary interstitial edema at altitude but not at simulated altitude. The context indicates that ascent to high altitude causes pulmonary interstitial edema and that high-intensity exercise in hypoxia (which occurs at altitude) induces the presence of b-lines, a marker of interstitial fluid. In contrast, after high-intensity intermittent exercise in normoxia (simulated altitude), no increase in b-lines was observed, suggesting no increase in pulmonary interstitial edema under those conditions.",yes,"Yes, high-intensity intermittent exercise does not increase pulmonary interstitial edema at altitude but not at simulated altitude. The context indicates that after high-intensity intermittent exercise, no increase in b-lines (a marker for pulmonary interstitial edema) was observed in normoxia, and the study assessed the impact of hypoxia at altitude. Since the findings show no increase in b-lines post-exercise, it suggests that such exercise does not promote pulmonary interstitial edema at altitude, based on the provided information.",no
25447846,Does alcohol disrupt levels and function of the cystic fibrosis transmembrane conductance regulator to promote development of pancreatitis?,"Based on studies of human, mouse, and guinea pig pancreata, alcohol disrupts expression and localization of the CFTR. This appears to contribute to development of pancreatitis. Strategies to increase CFTR levels or function might be used to treat alcohol-associated pancreatitis.",yes,"Yes, alcohol disrupts levels and function of the cystic fibrosis transmembrane conductance regulator (cftr), as ethanol reduces cftr stability at the cell surface, inhibits its activity, decreases its messenger RNA expression, causes misfolding, and impairs its function in pancreatic cells. These effects contribute to pancreatic dysfunction and promote the development of pancreatitis.",yes,"Maybe. The context indicates that ethanol reduces the stability, folding, and expression of cystic fibrosis transmembrane conductance regulator (CFTR) at the cell surface in pancreatic cells, inhibits CFTR activity, and decreases CFTR mRNA levels. Additionally, pancreatic tissues from patients with pancreatitis have lower CFTR levels, and ethanol administration is associated with CFTR misfolding and decreased stability, suggesting that alcohol disrupts CFTR levels and function, which may promote pancreatitis development.",maybe
25428728,Does hypercholesterolemia increase the production of leukotriene B4 in neutrophils by enhancing the nuclear localization of 5-lipoxygenase?,"Hypercholesterolemia increases LTB4 production in neutrophils by increasing the nuclear localization of 5-LO, which is the result of its phosphorylation by activated ERK1/2.",yes,"Yes, hypercholesterolemia increases the production of leukotriene B4 (ltb4) in neutrophils by enhancing the nuclear localization of 5-lipoxygenase (5-lo). The context indicates that in hypercholesterolemia, neutrophils exhibit increased nuclear localization of 5-lo, which is associated with heightened activity related to ltb4 synthesis, and this correlates with increased plasma levels of ltb4.",yes,"Maybe. The context indicates that hypercholesterolemia in rats is associated with increased nuclear localization of 5-lipoxygenase (5-lo) in neutrophils and elevated plasma levels of leukotriene B4 (ltb4). Additionally, in vitro cholesterol enrichment resulted in similar changes in 5-lo and ltb4 levels, and the increase in plasma ltb4 following lipopolysaccharide stimulation was observed in hypercholesterolemic rats. These findings suggest that hypercholesterolemia may enhance the nuclear localization of 5-lo, which is involved in ltb4 production, thereby potentially increasing ltb4 synthesis in neutrophils.",maybe
25451397,Do molecular signatures of mood stabilisers highlight the role of the transcription factor REST/NRSF?,Cell line models offer a window of what might happen in vivo but have the benefit of being human derived and homogenous with regard to cell type.,yes,"Maybe. The provided information highlights the roles of genes such as fos and jun, and their involvement in pathways affected by mood-modifying drugs, but it does not specify the role of the transcription factor REST/NRSF in the molecular signatures of mood stabilisers.",maybe,"Maybe. The provided context indicates that the study examined gene expression profiles related to mood disorders, but it does not specify whether molecular signatures of mood stabilisers highlight the role of the transcription factor REST/NRSF.",maybe
25439779,Does preconditioning of skeletal myoblast-based engineered tissue constructs enable functional coupling to myocardium in vivo?,"Although untreated skeletal myoblasts cannot couple to cardiomyocytes, we confirm that mechanical preconditioning enables transplanted skeletal myoblasts to functionally interact with cardiomyocytes in vivo and, thus, reinvigorate the concept of skeletal myoblast-based cardiac cell therapy.",yes,"Maybe. The context indicates that electrophysiologic coupling was effective in neonatal mouse skeletal myoblasts within the grafted construct, and mechanically preconditioned engineered tissue constructs were transplanted onto the heart. However, the suppression of proteins necessary for mechanical and electrical integration remains a major drawback, resulting in suboptimal conduction velocity (0.087 ± 0.011 m/sec) that hinders full functional coupling. Therefore, preconditioning may improve some aspects of integration, but it does not definitively enable complete functional coupling to myocardium in vivo based solely on the provided information.",maybe,"No, preconditioning of skeletal myoblast-based engineered tissue constructs does not enable functional coupling to myocardium in vivo. The context indicates that during differentiation into myotubes, skeletal myoblasts suppress the expression of proteins necessary for mechanical and electrical integration, which are essential for functional coupling with myocardium.",no
25437821,Does treatment with egg antigens of Schistosoma mansoni ameliorate experimental colitis in mice through a colonic T-cell-dependent mechanism?,Our results demonstrated that the administration of SmSEA reduces the severity of colitis in the adoptive transfer mouse model characterized by an increased Th2 response and a suppressed Th17 response in the colon.,yes,"Maybe. The context indicates that treatment with schistosoma mansoni soluble egg antigens (smsea) affects T cell populations in the colon, including increasing interleukin-4-producing T cells and decreasing interleukin-17a-producing T cells, and that this treatment improves inflammatory parameters in colitis mice. These findings suggest a T-cell-dependent mechanism may be involved, but the context does not explicitly confirm that the amelioration of colitis occurs specifically through a colonic T-cell-dependent mechanism.",maybe,"Yes, treatment with egg antigens of Schistosoma mansoni (smsea) ameliorates experimental colitis in mice through a colonic T-cell-dependent mechanism. The context indicates that smsea treatment led to immunological changes in T cells, such as increased interleukin-4-producing T cells and decreased interleukin-17a-producing T cells in the colon, which are associated with improved inflammatory parameters. Additionally, the treatment was initiated after T cell transfer, and the immunological effects observed suggest a T-cell-dependent mechanism.",yes
25450014,Is abnormal left ventricular contractile response to exercise in the absence of obstructive coronary artery disease associated with resting left ventricular long-axis dysfunction?,An abnormal LVCRE in the absence of established causes is associated with resting LV long-axis dysfunction and is usually seen in women.,yes,"Yes, abnormal left ventricular contractile response to exercise in the absence of obstructive coronary artery disease is associated with resting left ventricular long-axis dysfunction. The context indicates that patients with an abnormal response often exhibit impaired left ventricular long-axis function, evidenced by lower septal e prime velocities, suggesting a connection between the abnormal exercise response and resting long-axis dysfunction.",yes,"Maybe. The study indicates that patients with an abnormal left ventricular contractile response to exercise had reduced resting left ventricular long-axis function, as evidenced by lower septal e prime velocities, suggesting an association between abnormal response and resting long-axis dysfunction.",maybe
25440027,Does airway pressure release ventilation reduce conducting airway micro-strain in lung injury?,"In an injured lung, APRV 75% maintained micro-anatomic gas distribution similar to that of the normal lung. The lung protection demonstrated in previous studies using APRV 75% may be due to a more homogeneous distribution of gas at the micro-anatomic level as well as a reduction in conducting airway micro-strain.",yes,"Yes, airway pressure release ventilation (aprv) reduces conducting airway micro-strain in lung injury. The context indicates that aprv has been shown to minimize micro-strain in the conducting airways by reducing gas redistribution and optimizing ventilation settings, such as setting aprv at 75%, which effectively minimizes micro-strain compared to other methods.",yes,"Maybe. The study found that airway pressure release ventilation (aprv) set at 75% minimized micro-strain in the conducting airways, suggesting that aprv at this setting can reduce conducting airway micro-strain in lung injury.",maybe
25429227,Does low perfusion index affect the difference in glucose level between capillary and venous blood?,"In the emergency department, perfusion index value measured by Masimo Radical-7 and capillary blood glucose levels can serve in blood sugar management in critically ill patients.",yes,"No, low perfusion index does not affect the difference in glucose level between capillary and venous blood. The context indicates that significant differences and greater consistency between capillary and venous glucose measurements are observed at higher perfusion index levels (6 and above), whereas lower perfusion index levels are associated with more reliable and consistent glucose measurements, especially in certain patient groups.",no,"Maybe. The study indicates that in cases where at least one vital sign was abnormal, the glucose values obtained by capillary and venous methods were more consistent when the perfusion index was 6 or over, suggesting that low perfusion index (below 6) may affect the agreement between capillary and venous glucose measurements. However, the overall impact of low perfusion index on the difference in glucose levels between these blood sampling methods is not explicitly detailed, so the effect may be context-dependent.",maybe
25428431,Are multiple pathways responsible for anti-inflammatory and cardiovascular activities of Hordeum vulgare L?,These results suggest the likely mechanisms responsible for observed anti-inflammatory and cardiovascular effects of HV in traditional medicine.,yes,"Maybe. The context indicates that hordeum vulgare L. inhibits both cyclooxygenase (cox) and lipoxygenase (lox) pathways of arachidonic acid metabolism, which are involved in inflammatory processes, and influences antioxidant enzymes such as superoxide dismutase (sod) and glutathione peroxidase (gpx). This suggests that multiple pathways are involved in its anti-inflammatory and cardiovascular activities.",maybe,"Yes, multiple pathways are responsible for the anti-inflammatory and cardiovascular activities of Hordeum vulgare L. The evidence shows that barley inhibits both cyclooxygenase (cox) and lipoxygenase (lox) pathways of arachidonic acid metabolism, indicating involvement of multiple pathways. Additionally, different fractions of barley contain compounds that target these pathways and enhance antioxidant enzyme activities such as superoxide dismutase (sod) and glutathione peroxidase (gpx), further supporting the role of multiple mechanisms in its therapeutic effects.",yes
25432081,Does clinical evaluation of pazopanib eye drop versus ranibizumab intravitreal injections in subjects with neovascular age-related macular degeneration?,Pazopanib was well tolerated. Daily pazopanib eye drops in neovascular AMD subjects did not result in therapeutic benefit beyond that obtained with ranibizumab alone.,yes,"Maybe. The context indicates that pazopanib eye drops are being evaluated in comparison to intravitreal ranibizumab injections for age-related macular degeneration, but it does not specify that a clinical evaluation directly comparing the two methods has been completed or reported.",maybe,Maybe. The provided context does not include specific information about a clinical evaluation comparing pazopanib eye drops to ranibizumab intravitreal injections in subjects with neovascular age-related macular degeneration.,maybe
25432085,Does long-term treadmill exercise attenuate tau pathology in P301S tau transgenic mice?,"Our results suggest that forced treadmill exercise differently affects the brain and spinal cord of aged P301S tau mice, with greater benefits observed in the spinal cord versus the brain. Our work adds to the growing body of evidence that exercise is beneficial in tauopathy, however these benefits may be more limited at later stages of disease.",yes,"Yes, long-term treadmill exercise attenuates tau pathology in P301S tau transgenic mice. Specifically, it results in significant reductions in hyperphosphorylated tau in the hippocampus and full-length tau in the spinal cord, as well as a reduction of sarkosyl-insoluble at8-tau in the spinal cord.",yes,"Maybe. The context indicates that forced treadmill exercise resulted in significant reductions in hyperphosphorylated tau and sarkosyl-insoluble at8-tau in the spinal cord of p301s tau transgenic mice, suggesting some attenuation of tau pathology. However, it did not attenuate neuron loss in the cortex or hippocampus, and effects on other forms of tau aggregation or neurofibrillary tangles are unknown.",maybe
25431267,Does subclinical left ventricular dysfunction by echocardiographic speckle-tracking strain analysis relate to outcome in sarcoidosis?,"LVGLS is impaired in sarcoidosis patients, suggesting subclinical cardiac dysfunction despite the absence of conventional evidence of cardiac disease, and is independently associated with occurrence of cardiac events and/or development of CS.",yes,"Yes, subclinical left ventricular dysfunction assessed by echocardiographic speckle-tracking strain analysis relates to outcomes in sarcoidosis. The study found that impaired lv global longitudinal strain significantly predicts adverse outcomes in patients with sarcoidosis, indicating its prognostic value.",yes,"Maybe. The context indicates that LV global longitudinal strain was significantly impaired in patients with sarcoidosis and that the study investigated whether this measure predicts adverse outcomes. However, it does not explicitly state whether subclinical left ventricular dysfunction by speckle-tracking strain analysis is directly related to outcomes in sarcoidosis.",maybe
25431265,Are guanine quadruplexes formed by specific regions of human transposable elements?,Conservation of quadruplexes at specific positions of transposable elements implies their importance in their life cycle. The increasing quadruplex presence in evolutionarily young LINE-1 and SVA families makes these elements important contributors toward present genome-wide quadruplex distribution.,yes,"Yes, guanine quadruplexes are formed by specific regions of human transposable elements. The context indicates that potential quadruplex sequences (pqss) in human retrotransposons, which include elements like SVA, have specific guanine quadruplex structures confirmed by circular dichroism spectroscopy.",yes,Insufficient information.,maybe
