pubmed_id,question,actual_answer,actual_result,answer_ordinary,result_ordinary,answer_no_inferred,result_no_inferred
25433161,Does vagus nerve contribute to the development of steatohepatitis and obesity in phosphatidylethanolamine N-methyltransferase deficient mice?,Neuronal signals via the hepatic vagus nerve contribute to the development of steatohepatitis and protection against obesity in HFD fed Pemt(-/-) mice.,yes,"No, the vagus nerve does not contribute to the development of steatohepatitis and obesity in phosphatidylethanolamine N-methyltransferase deficient mice. The context indicates that disruption of the hepatic afferent vagus nerve by capsaicin failed to prevent or reverse the development of diet-induced steatohepatitis and obesity in pemt knockout mice, suggesting that the vagus nerve's signaling does not play a significant role in these processes in this model.",no,"No, the vagus nerve does not contribute to the development of steatohepatitis and obesity in phosphatidylethanolamine N-methyltransferase deficient mice. The context indicates that disruption of the hepatic afferent vagus nerve by capsaicin failed to prevent or reverse the development of diet-induced steatohepatitis and obesity in pemt knockout mice, suggesting that the vagus nerve is not a contributing factor in this process.",no
25445714,Does psammaplin A induce Sirtuin 1-dependent autophagic cell death in doxorubicin-resistant MCF-7/adr human breast cancer cells and xenografts?,"PsA significantly inhibited MCF-7/adr cells proliferation in a concentration-dependent manner, with accumulation of cells in G2/M phase of the cell cycle. PsA significantly decreased SIRT1 enzyme activity and reduced expression of SIRT1 protein in the cultured cells with greater potency than sirtinol or salermide. Acetylation of p53, a putative target of SIRT1, increased significantly following PsA treatment. In addition, PsA markedly increased the expression levels of autophagy-related proteins. In support of this, it was found that PsA significantly increased the expression of damage-regulated autophagy modulator (DRAM), a p53-induced protein.",yes,"Maybe. The context indicates that psammaplin A was tested in doxorubicin-resistant MCF-7/adr human breast cancer cells to evaluate its effect on autophagic cell death, but it does not specify whether this process is Sirtuin 1-dependent.",maybe,"Maybe. The context indicates that the autophagic cell death pathway in doxorubicin-resistant MCF-7 human breast cancer cells was tested, but it does not specify whether psammaplin A induces Sirtuin 1-dependent autophagic cell death in these cells and xenografts.",maybe
25432519,Do tumor-infiltrating immune cell profiles and their change after neoadjuvant chemotherapy predict response and prognosis of breast cancer?,"Breast cancer immune cell subpopulation profiles, determined by immunohistochemistry-based computerized analysis, identify groups of patients characterized by high response (in the pre-treatment setting) and poor prognosis (in the post-treatment setting). Further understanding of the mechanisms underlying the distribution of immune cells and their changes after chemotherapy may contribute to the development of new immune-targeted therapies for breast cancer.",yes,"Maybe. The context indicates that tumor-infiltrating immune cell profiles and their changes after neoadjuvant chemotherapy are associated with response and prognosis in breast cancer, with certain profiles predicting pathological complete response and correlating with treatment outcomes. However, the contribution of these immune profiles, especially post-treatment residual tumor profiles, remains unclear, suggesting that while there is a significant association, their predictive value is not fully established.",maybe,"Maybe. The context indicates that tumor-infiltrating immune cell profiles and their changes after neoadjuvant chemotherapy are associated with response and prognosis in breast cancer, with certain profiles predicting pathological complete response and immune profiles correlating with survival outcomes. However, it also states that the contribution of these profiles to response and prognosis is still unclear, suggesting that while there is some predictive value, it is not yet fully established.",maybe
25440440,Is hidradenitis suppurativa a systemic disease with substantial comorbidity burden : a chart-verified case-control analysis?,Control subjects were not validated for absence of HS and comorbidity validation was not performed for either group.,yes,"Maybe. The context indicates that hidradenitis suppurativa is a chronic inflammatory disease associated with a substantial comorbidity burden, as verified cases showed significantly higher prevalences of comorbidities compared to controls, suggesting it may be considered a systemic disease with substantial comorbidities.",maybe,"Yes, hidradenitis suppurativa is associated with a substantial comorbidity burden as the study found that all comorbidities were diagnosed significantly more often in patients with hidradenitis suppurativa compared to controls, indicating it may be a systemic disease with notable comorbidities.",yes
25444977,Does reference range for serum and salivary testosterone in young men of Mediterranean region?,"In men from the Mediterranean region, values of TT>9.7 nmol/L, CFT>0.22 nmol/L, and/or CBT>4.9 nmol/L make the presence of biochemical hypogonadism unlikely. According to the correlation between serum and ST, the clinical value of ST remains to be established.",yes,"Maybe. The study provides a reference range for salivary testosterone in healthy young men from the Mediterranean region, which is 0.19 to 0.68 nanomoles per liter, with a measured level of 0.35 nanomoles per liter. However, it does not specify a detailed reference range for serum testosterone in this population.",maybe,"Yes, the reference range for salivary testosterone in healthy young men from the Mediterranean region is 0.19 to 0.68 nanomoles per liter, as indicated by the study. The reference range for serum total testosterone is 9.7 to 33.3 nanomoles per liter.",yes
25429648,Are secretory phospholipases A2 secreted from ciliated cells and increase mucin and eicosanoid secretion from goblet cells?,"sPLA2 are secreted from ciliated cells and appear to induce mucin and cysLT secretion from goblet cells, strongly suggesting that airway goblet cells are proinflammatory effector cells.",yes,"Maybe. The context indicates that secretory phospholipases A2 (spla2), particularly spla2 v, are secreted from ciliated-enriched cells and can induce mucin hypersecretion and eicosanoid biosynthesis. However, spla2 is not secreted from goblet-enriched cells, and immunostaining shows spla2 v is not positive in goblet cells. Therefore, while spla2 from ciliated cells can increase mucin and eicosanoid secretion, it is not secreted from goblet cells themselves.",maybe,"Yes, secretory phospholipases A2 (spla2) are secreted from ciliated cells and increase mucin and eicosanoid secretion from goblet cells. The context indicates that spla2 is secreted from the apical side of ciliated-enriched cells, with immunostaining strongly positive in these cells, and that spla2 induces mucin hypersecretion and biosynthesis of eicosanoids, which include cysteinyl leukotrienes. Although spla2 is not secreted from goblet cells themselves, it promotes mucin secretion from goblet cells, and its activity leads to increased eicosanoid production.",yes
25432781,Does increased Syk phosphorylation lead to overexpression of TRAF6 in peripheral B cells of patients with systemic lupus erythematosus?,"Our results suggest that the activated Syk-mediated TRAF6 pathway leads to aberrant activation of B cells in SLE, and also highlight Syk as a potential target for B-cell-mediated processes in SLE.",yes,"Maybe. The context indicates that traf6 expression is influenced by syk phosphorylation and that increased syk phosphorylation is associated with disease activity in SLE patients. Additionally, traf6 is significantly over-expressed in B cells of SLE patients, and there is a correlation between syk phosphorylation and traf6 expression. However, it is not explicitly stated that increased syk phosphorylation directly causes overexpression of traf6, only that they are correlated and influenced by each other.",maybe,"Yes, increased Syk phosphorylation is associated with overexpression of TRAF6 in peripheral B cells of patients with systemic lupus erythematosus. The context indicates a significant correlation between levels of TRAF6 expression and Syk phosphorylation in B cells from SLE patients, and that both Syk phosphorylation and TRAF6 overexpression are observed in these patients.",yes
25429481,Are reasons why erupted third molars extracted in a public university in Mexico?,"Women and patients 18 to 34 years of age had erupted 3M extracted more frequently, primarily for prosthetic reasons. The age profile indicated a trend in demand for services that differ from those of overall tooth extractions, but not for the trend across gender.",yes,"Maybe. The study aimed to determine the reasons for erupted third molar extractions in Mexican patients, including prosthetic, orthodontic, dental caries, and periodontal disease as reasons. However, it does not specify whether these reasons are specifically why erupted third molars are extracted in a public university setting in Mexico.",maybe,"Yes, the reasons for erupted third molars extraction in the studied Mexican patients include prosthetic needs (44.0%), orthodontic reasons (24.7%), dental caries (20.0%), and periodontal disease (11.3%).",yes
25424372,Does the Boston keratoprosthesis provide a wide depth of focus?,The KPro's wide depth-of-focus makes the visual acuity less dependent on an exact refractive correction at distance and explains the 'pseudoaccomodation' experienced by these patients. This is primarily due to the small pupil diameter of the KPro. The current manufacturing steps in 0.50 dioptre increments appears to be sufficient.,yes,"Maybe. The context discusses the through-focus curve and visual performance related to keratoprosthesis, but it does not explicitly state whether the Boston keratoprosthesis provides a wide depth of focus.",maybe,"Maybe. The context indicates that the through-focus curve of keratoprosthesis eyes was made comparable to that of control eyes after adjusting the pupil size, but it does not explicitly state whether the Boston keratoprosthesis provides a wide depth of focus.",maybe
25449410,Do large portion sizes increase bite size and eating rate in overweight women?,"Increasing portion size led to a larger bite size and faster eating rate, but a slower reduction in eating speed during the meal. These changes may underlie greater energy intakes with exposure to large portions. Interventions to reduce bite size and slow eating rate may provide individuals with strategies to reduce the risk of overconsumption.",yes,"Maybe. The context indicates that larger portion sizes increase meal duration and influence parameters related to eating behavior, such as increasing food intake and affecting eating rate. Specifically, larger portions lead to increased meal duration and a deceleration rate decrease, which suggests that bite size and eating rate are affected by portion size. However, the effect on bite size itself is not explicitly stated, so the direct relationship remains unclear.",maybe,"Maybe. The context indicates that larger food portion sizes increase meal duration and overall food intake, but the effect on bite size and eating rate specifically is not directly addressed. The effect of food portion size on eating rate was non-linear and increased up to a certain point, and meal duration increased with larger portions, suggesting that eating rate may be affected, but the mechanism and specific impact on bite size and eating rate in overweight women are unclear.",maybe
25445712,Does pancreatic polypeptide regulate glucagon release through PPYR1 receptors expressed in mouse and human alpha-cells?,Glucose stimulates PP secretion and PP inhibits glucagon release in mouse pancreatic islets. PP receptors are present in alpha-cells of mouse and human pancreatic islets.,yes,"Maybe. The context indicates that the ppyr1 receptor inhibits glucagon release and is expressed in mouse alpha-cells, suggesting it may regulate glucagon secretion. However, it does not explicitly confirm that pancreatic polypeptide regulates glucagon release through PPYR1 receptors in human alpha-cells.",maybe,"Maybe. The context indicates that the ppyr1 receptor is expressed in the glucagon alpha-cell fraction of pancreatic islets, and direct exposure of pancreatic islets to pancreatic polypeptide inhibits glucagon release. However, it does not explicitly confirm that pancreatic polypeptide regulates glucagon release specifically through PPYR1 receptors in mouse and human alpha-cells.",maybe
25440267,Is increased time from neoadjuvant chemoradiation to surgery associated with higher pathologic complete response rates in esophageal cancer?,A longer interval between completion of neoadjuvant chemoradiation and surgery was associated with higher pathologic complete response rates without an impact on surgical morbidity.,yes,"Maybe; the impact of the timing of surgery after neoadjuvant chemoradiation on pathologic complete response rates in esophageal cancer is related to an increasing time interval between the end of chemoradiation and surgery, and this timing significantly affects the response rates, with the interval being an important predictor of therapy response.",maybe,"Maybe. The context indicates that the interval between neoadjuvant chemoradiation and surgery has been described as an important predictor of pathologic response in nonesophageal cancer sites, but the specific study on esophageal cancer found no association between increasing time interval and outcomes such as length of stay or response rates. Therefore, based on this information, increased time from chemoradiation to surgery is not associated with higher pathologic complete response rates in esophageal cancer.",no
25444989,Is congenital penile pathology associated with abnormal development of the dartos muscle : a prospective study of primary penile surgery at a tertiary referral center?,"Congenital penile pathology (hypospadias, buried penis) is associated with structural anomalies in dartos tissue. Further research is needed to unveil the pathophysiology of the condition.",yes,"Maybe. The context indicates that tissue samples were collected from children undergoing primary penile surgery for conditions such as hypospadias, epispadias, or buried penis, but it does not specify whether congenital penile pathology is associated with abnormal development of the dartos muscle.",maybe,"Maybe. The context indicates that tissue samples were collected from children undergoing primary penile surgery for conditions such as hypospadias, epispadias, or buried penis, but it does not specify whether congenital penile pathology is associated with abnormal development of the dartos muscle.",maybe
25444981,Is δNp63 expression a protective factor of progression in clinical high grade T1 bladder cancer?,"ΔNp63 expression is a favorable prognostic factor in clinically high grade T1 bladder cancer. This marker identifies patients at low risk for progression who could benefit from conservative therapy with transurethral bladder tumor resection and bacillus Calmette-Guérin, avoiding over treatment with immediate radical cystectomy.",yes,"Maybe. The study indicates that no progression to muscle invasive disease was observed in patients with tumors that maintained δnp63 expression, with a statistically significant difference (p < 0.001). This suggests that δnp63 expression may be associated with a protective effect against progression in high grade T1 bladder cancer.",maybe,"Yes, δNp63 expression is a protective factor of progression in clinical high grade T1 bladder cancer. The context indicates that no progression to muscle invasive disease was observed in patients with tumors that maintained δNp63 expression, and this difference was statistically significant (p < 0.001), suggesting a protective role against disease progression.",yes
25436308,Do high levels of procalcitonin in the early phase after pediatric liver transplantation indicate poor postoperative outcome?,High levels of PCT after pLTx are an early indicator of poor postoperative outcome and may reflect ischemia induced liver cell injury within the context of an ischemia- reperfusion injury.,yes,"Yes, high levels of procalcitonin in the early phase after pediatric liver transplantation indicate a worse postoperative outcome. The context indicates that elevated procalcitonin levels are associated with increased morbidity, longer ICU stays, higher INR values, and longer mechanical ventilation, all of which suggest poorer postoperative prognosis.",yes,"Maybe. The study indicates that high procalcitonin levels on postoperative day 2 are associated with longer ICU stays, longer mechanical ventilation, higher INR values, and elevated serum lactate levels, which suggest a more complicated postoperative course. However, there was no correlation between procalcitonin elevation and systemic infection, and no direct data linking early procalcitonin levels to overall morbidity or graft function. Therefore, while high early procalcitonin levels may reflect a more severe postoperative state, they do not definitively indicate poor outcome.",maybe
25446283,Does ephrin type-B receptor 4 activation reduce neointimal hyperplasia in human saphenous vein in vitro?,"Eph-B4 is present and functional in adult human saphenous veins, with intact downstream signaling pathways capable of NO release and prevention of neointimal hyperplasia in vitro. Adventitial delivery of ephrin-B2/Fc activates endothelial Eph-B4 in saphenous veins treated with arterial shear stress in vitro. These results suggest that stimulation of Eph-B4 function may be a candidate strategy for translation to human clinical trials designed to inhibit venous neointimal hyperplasia.",yes,"Maybe. The context indicates that eph-b4 activation via ephrin-b2/fc has been shown to prevent neointimal hyperplasia in murine vein grafts and interacts with human veins in vitro, but it does not explicitly confirm that activation reduces neointimal hyperplasia in human saphenous veins in vitro.",maybe,"Maybe. The context indicates that eph-b4 activation with ephrin-b2/fc was examined in human saphenous veins and that it prevents neointimal hyperplasia in murine models. However, it does not explicitly state that eph-b4 activation reduces neointimal hyperplasia in human saphenous veins in vitro.",maybe
25447851,Are polymorphisms near TBX5 and GDF7 associated with increased risk for Barrett 's esophagus?,"We identified 2 loci associated with risk of BE and provided data to support a further locus. The genes we found to be associated with risk for BE encode transcription factors involved in thoracic, diaphragmatic, and esophageal development or proteins involved in the inflammatory response.",yes,"No, polymorphisms near TBX5 and GDF7 are not mentioned as being associated with increased risk for Barrett's esophagus in the provided information.",no,"No, the provided information does not indicate an association between polymorphisms near TBX5 and GDF7 and increased risk for Barrett's esophagus. The context mentions risk loci near other genes such as HLA, FOXF1, BARX1, CRTC1, FOXP1, and specific SNPs like rs3072 and rs2701108, but does not reference TBX5 or GDF7.",no
25429340,Is p63 more sensitive and specific than 34βE12 to differentiate adenocarcinoma of prostate from cancer mimickers?,Basal cell markers can help to distinguish prostate adenocarcinoma from cancer mimickers.,yes,"Maybe. The study found that both p63 and 34βE12 were negative in all prostate adenocarcinoma specimens, indicating that neither marker is expressed in prostate adenocarcinoma. However, 34βE12 is used to differentiate prostate adenocarcinoma from benign prostate lesions and hyperplasia because it is expressed in benign conditions, whereas p63 is also used for differentiation but is expressed in benign prostate hyperplasia. The information does not specify that p63 is more sensitive or specific than 34βE12; rather, both markers are helpful in identifying basal cells in benign conditions and their absence in adenocarcinoma.",maybe,"No, p63 is not more sensitive and specific than 34βE12 for differentiating prostate adenocarcinoma from cancer mimickers. The study found that both p63 and 34βE12 were negative in all prostate adenocarcinoma specimens, while both were expressed in benign prostate hyperplasia and high-grade intraepithelial neoplasia, indicating that neither marker is useful for identifying prostate adenocarcinoma specifically.",no
25448803,Is tGFBI Expression in Cancer Stromal Cells Associated with Poor Prognosis and Hematogenous Recurrence in Esophageal Squamous Cell Carcinoma?,High TGFBI expression in ESCC tissues could be a powerful biomarker of poor prognosis and hematogenous recurrence. TGFBI in stromal cells might be a promising molecular target for ESCC treatment.,yes,"Maybe. The context indicates that transforming growth factor-beta-induced protein (TGFBI) is mainly localized in stromal cells of esophageal squamous cell carcinoma and that high TGFBI expression is associated with enhanced migration and invasion capabilities, as well as being an independent prognostic factor. However, the specific association between TGFBI expression in stromal cells and poor prognosis and hematogenous recurrence is not explicitly stated in the provided information.",maybe,"Yes, the expression of transforming growth factor-beta-induced protein (TGFBI) in stromal cells of esophageal squamous cell carcinoma is associated with poor prognosis and hematogenous recurrence. The high TGFBI expression was identified as an independent prognostic factor, and its localization mainly in stromal cells suggests a significant role in disease progression.",yes
25439493,Does identical ATP1A3 mutation cause alternating hemiplegia of childhood and rapid-onset dystonia parkinsonism phenotypes?,"The discordance of these phenotypes suggests that there are other undiscovered environmental, genetic, or epigenetic factors influencing the development of alternating hemiplegia of childhood or rapid-onset dystonia parkinsonism.",yes,"Maybe. The context indicates that the atp1a3 mutation associated with alternating hemiplegia of childhood is similar but not identical to the mutation found in rapid-onset dystonia parkinsonism, and that these are considered separate movement disorders with different dominant mutations. Therefore, an identical ATP1A3 mutation does not necessarily cause both phenotypes.",maybe,"No, the identical ATP1A3 mutation does not cause both alternating hemiplegia of childhood and rapid-onset dystonia parkinsonism phenotypes. The context indicates that these two disorders have different dominant mutations in the ATP1A3 gene, and the mutation found in the child with alternating hemiplegia of childhood had not been previously described in such cases.",no
25450181,Does metabolic control analysis of the Trypanosoma cruzi peroxide detoxification pathway identify tryparedoxin as a suitable drug target?,"These quantitative kinetic and metabolic analyses pointed out to TXN as a convenient drug target due to its low catalytic efficiency, high control on the flux of peroxide detoxification and role as provider of reducing equivalents to the two main peroxidases in the parasite.",yes,"Maybe. The metabolic control analysis indicates that tryparedoxin (txn) controls 90-100% of the pathway flux in the tryparedoxin-dependent peroxide detoxification pathway in trypanosoma cruzi, suggesting it plays a significant role in pathway regulation. However, kinetic characterization shows that tryparedoxin is less efficient due to its high km and low vmax, which may limit its suitability as a drug target.",maybe,"Maybe. The metabolic control analysis identified that the redox pairs txn-txnpx and txn-gpxa control 90-100% of the pathway flux, indicating that tryparedoxin (txn) plays a significant role in controlling peroxide detoxification in T. cruzi. However, the analysis also showed that tryparedoxin has high apparent km and low vmax values, suggesting it is less efficient within the pathway. While its central role in controlling flux makes it a potential target, its lower efficiency may impact its suitability as a drug target based solely on this analysis.",maybe
25450186,Is basal Flt1 tyrosine kinase activity a positive regulator of endothelial survival and vascularization during zebrafish embryogenesis?,Flt1-tyrosine kinase (TK) activity contributed significantly in endothelial cells survival and vascular development during embryo angiogenesis in zebrafish by engaging PI3K/Akt pathway.,yes,Maybe. The context indicates that flt1 (vegfr-1) is generally considered a decoy receptor for trapping vegf and its role in vascular formation has not been well studied. There is no direct evidence in the provided information that basal Flt1 tyrosine kinase activity acts as a positive regulator of endothelial survival and vascularization during zebrafish embryogenesis.,maybe,"No, basal Flt1 tyrosine kinase activity is not a positive regulator of endothelial survival and vascularization during zebrafish embryogenesis. The context indicates that flt1 (vegfr-1) is generally considered a decoy receptor for trapping vegf, and the blood vessel loss caused by vri was not observed in zebrafish embryos injected with flt1 morpholino, suggesting that Flt1 kinase activity does not promote vascularization in this context.",no
