pubmed_id,question,actual_answer,actual_result,answer_ordinary,result_ordinary,answer_no_inferred,result_no_inferred
27519469,Do compound heterozygotes for filaggrin gene mutations always show severe atopic dermatitis?,Our results suggest that individuals with bi-allelic FLG mutations do not always have severe AD and confirm that not all individuals with bi-allelic FLG mutations have AD.,no,"Maybe. The effect of bi-allelic filaggrin gene mutations on atopic dermatitis severity remains controversial, and some patients with such mutations may show varying severity or even no signs of the condition at all.",maybe,"Maybe. The effect of bi-allelic filaggrin gene mutations (compound heterozygosity) on atopic dermatitis incidence and severity remains controversial, and the difference in mutation frequency between children with and without atopic dermatitis was not statistically significant.",maybe
27496822,Does serum proatrial natriuretic peptide increase with higher systolic blood pressure in obese men?,"Contrary to known physiological BP responses, MR-proANP was negatively associated with ABP in our study. This suggests that a low amount of circulating NPs could play a role in the early stage of obesity-related hypertension.",no,"Maybe. The context indicates that serum midregional proatrial natriuretic peptide (a form of proatrial natriuretic peptide) is negatively associated with systolic blood pressure, meaning that higher systolic blood pressure is generally associated with lower circulating levels of this peptide. However, it also states that higher blood pressure in obese men is associated with increased circulating natriuretic peptides, suggesting a complex relationship. Therefore, based solely on the provided information, it is not definitively clear that serum proatrial natriuretic peptide increases with higher systolic blood pressure in obese men.",maybe,"No, serum proatrial natriuretic peptide does not increase with higher systolic blood pressure in obese men. The context indicates that serum midregional proatrial natriuretic peptide was negatively associated with systolic ambulatory blood pressure (β = -0.32, p = 0.004), meaning that as systolic blood pressure increases, serum proatrial natriuretic peptide levels tend to decrease.",no
27503696,Is infection a Risk Factor for Perioperative and Postoperative Blood Loss and Transfusion in Revision Total Hip Arthroplasty?,"Although blood loss and transfusion rates were higher in septic revisions, the presence of infection alone did not increase the risk of transfusion or blood loss. Blood management strategies in revision total hip arthroplasties should be guided by the type of surgery planned and patient's preoperative health rather than the presence of infection.",no,"Maybe. The context indicates that it is unclear whether blood loss and transfusion requirements differ between septic and aseptic revision total hip arthroplasties, suggesting that infection as a risk factor for perioperative and postoperative blood loss and transfusion is not definitively established based on the provided information.",maybe,"Maybe. The context indicates that it is unclear whether blood loss and transfusion requirements differ between septic and aseptic revision total hip arthroplasties, suggesting that infection as a risk factor for perioperative and postoperative blood loss and transfusion is not definitively established based on the provided information.",maybe
27495927,"'s it only what you say , it 's also how you say it : communicating nipah virus prevention messages during an outbreak in Bangladesh?","During outbreaks, one-way behaviour change communication without meaningful causal explanations is unlikely to be effective. Based on the cultural context, interactive communication strategies in lay language with supporting evidence can make biomedical prevention messages credible in affected communities, even among those who initially invoke supernatural causal explanations.",no,"No, it’s not only what you say, it’s also how you say it. The context indicates that researchers used an interactive strategy, including showing photos of transmission routes and engaging residents, to effectively communicate prevention messages during the outbreak. This approach helped residents understand transmission and influenced their behaviors, highlighting the importance of communication style in conveying health messages.",yes,"Yes, it is not only what you say but also how you say it. The context highlights that effective communication during the Nipah virus outbreak involved using an interactive strategy, including visual aids and culturally appropriate messaging, which helped residents understand transmission and adopt safer behaviors. The way messages are delivered influences their acceptance and impact.",yes
27492803,Is high-flow-mediated constriction in adults influenced by biomarkers of cardiovascular and metabolic risk?,"Increased body mass, fat mass, and body mass index were associated with a greater H-FMC. When H-FMC was present, the FMD response to reactive hyperemia was significantly lower. Because H-FMC has been observed to negatively affect FMD response to reactive hyperemia, we suggest that H-FMC should be noted when analyzing and interpreting FMD data. H-FMC may be an ancillary measure of endothelial health. © 2016 Wiley Periodicals, Inc. J Clin Ultrasound, 2016.",no,"Maybe. The context indicates that the study aimed to examine the relationship between high-flow-mediated constriction (h-fmc) and biomarkers of cardiovascular and metabolic risk, suggesting a potential influence. However, it does not explicitly confirm that h-fmc is influenced by these biomarkers, only that the relationship was being investigated.",maybe,"Maybe. The context indicates that the study aimed to examine the relationship between high-flow-mediated constriction (h-fmc) and biomarkers of cardiovascular and metabolic risk, suggesting a potential influence. However, it does not explicitly confirm that h-fmc is influenced by these biomarkers, only that the relationship was being investigated.",maybe
27489502,Does fibroblast Growth Factor Receptor 3 Deficiency Impair the Osteoanabolic Action of Parathyroid Hormone on Mice?,"Bone anabolic effects of PTH were not impaired by the absence of FGFR3, suggesting that the FGFR3 signaling may not be required for osteoanabolic effects of PTH activities.",no,"Maybe. The context indicates that parathyroid hormone (pth) stimulates bone formation in fgfr3-deficient mice, as evidenced by increased trabecular bone volume and normal responses in osteoblast proliferation and differentiation following pth treatment. However, the exact mechanisms by which fgfr3 deficiency impairs or influences the osteoanabolic action of pth are not fully defined, suggesting that while pth can promote bone formation in fgfr3-deficient mice, the impairment or full dependence of this process on fgfr3 remains unclear.",maybe,"No, fibroblast growth factor receptor 3 deficiency does not impair the osteoanabolic action of parathyroid hormone on mice. The context indicates that parathyroid hormone treatment increased trabecular bone volume, bone formation, and mechanical properties in both fgfr3-deficient and wild-type mice, with osteoblasts maintaining normal responses to PTH stimulation, including proliferation, differentiation, and signaling pathways.",no
27493887,Does obesity Modify the Risk of Differentiated Thyroid Cancer in a Cytological Series of Thyroid Nodules?,"The results of this study, in a retrospective series of patients with thyroid nodules, do not confirm previous findings reporting an association between obesity and differentiated thyroid carcinoma. Thus, obese patients with nodular thyroid disease should be managed the same as normal-weight patients.",no,"No, obesity does not modify the risk of differentiated thyroid cancer in a cytological series of thyroid nodules. The study found that the prevalence of suspicious or malignant nodules (thy4 or thy5 cytology) did not significantly differ across different BMI groups, as indicated by a p-value of 0.29, suggesting no statistically significant association between obesity and thyroid cancer risk in this population.",no,"Maybe. The study indicates that the prevalence of suspicious or malignant nodules classified as thy4 or thy5 did not differ significantly across BMI groups (p=0.29), suggesting that obesity may not modify the risk of differentiated thyroid cancer in this cytological series.",maybe
27490042,Is lentiviral HSV-Tk.007-mediated suicide gene therapy toxic for normal brain cells?,"We show that HSV-Tk.007-mediated suicide gene therapy is not toxic to normal brain cells. This observation is of high relevance for the translation of lentivirus-mediated suicide gene therapies into the clinic for the treatment of brain tumor patients. Copyright © 2016 John Wiley & Sons, Ltd.",no,"Maybe. The context indicates that lentiviral vectors delivering the hsv-tk gene, including hsv-tk.007, promote inflammatory responses and apoptosis in brain cells, which suggests potential toxicity. However, these strategies are primarily being investigated for their efficacy in treating brain tumors, and the information does not specify whether normal brain cells are adversely affected.",maybe,"Maybe. The context indicates that lentiviral vectors delivering hsv-tk have shown promising treatment effects in experimental brain tumors, but it does not specify whether they are toxic to normal brain cells. Therefore, based solely on the provided information, it cannot be confirmed that the therapy is toxic to normal brain cells.",maybe
27500970,Is prophylactic Gentamicin Associated with Acute Kidney Injury in Patients with Open Fractures?,"Prophylactic gentamicin is not associated with AKI, whereas hypotension on admission and higher ISS were. The use of nephrotoxic agents, including aminoglycosides, should be restricted in open fracture patients presenting with hypotension or a high ISS.",no,"No, prophylactic gentamicin was not associated with acute kidney injury in patients with open fractures. The data shows an odds ratio of 0.22 with a p-value of 0.22, indicating no statistically significant association between gentamicin administration and AKI in this context.",no,"Maybe. The data indicates that gentamicin administration was not associated with acute kidney injury in this context, with an odds ratio of 0.22 and a p-value of 0.22, suggesting no significant association. However, since aminoglycosides are associated with AKI in other settings, and the risk in open fracture prophylaxis has not been definitively established, the evidence is inconclusive.",maybe
27519165,Does continuous Pringle maneuver affect outcomes of patients with hepatocellular carcinoma after curative resection?,"Continuous PM effectively reduces intraoperative bleeding and does not adversely impact the outcomes of HCC patients. It remains a valuable tool in hepatic resection, even difficult, complicated resections requiring prolonged clamping times.",no,"Yes, continuous Pringle maneuver adversely impacts the outcomes of patients with hepatocellular carcinoma after curative resection. The context indicates that the technique has negative effects on surgical outcomes in these patients, and the study aimed to investigate this potential adverse impact.",yes,"Yes, the study aimed to investigate whether the continuous Pringle maneuver adversely impacts the outcomes of patients with hepatocellular carcinoma after curative resection.",yes
27501808,'s it just the big kids : both high and low BMI impact bracing success for adolescent idiopathic scoliosis?,"Based on our results, children on either end of the BMI spectrum are more likely to fail brace treatment for scoliosis than their mid-BMI counterparts. In high-BMI patients, this appears to be in large part attributable to an inadequacy of in-brace curve correction as well as to poorer brace compliance, while a low BMI appears to be an independent risk factor for brace failure.",no,"Yes, both high and low BMI impact bracing success for adolescent idiopathic scoliosis. The context indicates that a low BMI is associated with poorer outcomes and higher failure rates in brace treatment, while a high BMI is also linked to increased risk of orthotic failure and less effective management, highlighting that both extremes of BMI influence treatment success.",yes,"Maybe. The study's hypothesis focused on overweight children being more likely to fail brace treatment, suggesting that high BMI may impact bracing success. However, the context does not specify whether low BMI also affects outcomes, only that the study aimed to determine at which body habitus orthotic management becomes less effective. Therefore, both high and low BMI could potentially impact success, but the provided information emphasizes overweight status as a factor.",maybe
27506482,"Are enemas , suppositories and rectal stimulation effective in accelerating enteral feeding or meconium evacuation in low-birthweight infants : a systematic review?","Suppositories were ineffective in shortening the time to reach full enteral feeding, and the evidence on enemas was contradictory. Enemas and rectal stimulation did not shorten the time until complete meconium evacuation was reached. Further research into safe, effective interventions to accelerate meconium excretion is needed.",no,"Yes, the systematic review examined the effectiveness of enemas, suppositories, and rectal stimulation on stooling patterns in low-birthweight infants born at up to 32 weeks of gestation.",yes,"Maybe. The systematic review examined the effectiveness of rectal stimulation, suppositories, and enemas on stooling patterns in low-birthweight infants born at up to 32 weeks of gestation, but the provided context does not specify whether these interventions are effective in accelerating enteral feeding or meconium evacuation.",maybe
27519926,Do manual Lymphatic Drainage and Active Exercise Effects on Lymphatic Function Translate Into Morbidities in Women Who Underwent Breast Cancer Surgery?,MLD and active exercise effects are equivalent with regard to morbidity. Minor changes in lymphatic function associated with either MLD or active exercises were not related to patients' symptoms or signs.,no,"Maybe. The context indicates that manual lymphatic drainage and active exercise are part of treatment strategies for women after breast cancer surgery, with some evidence suggesting improved outcomes in lymphatic alterations and no significant increase in lymphoedema incidence. Therefore, these interventions do not appear to translate into increased morbidities, but their effects are generally positive or neutral rather than harmful.",maybe,"Maybe. The context indicates that low to moderate intensity weight-training exercises did not increase the incidence of breast cancer-related lymphoedema, and the study aimed to evaluate the effects of manual lymphatic drainage and active exercise on lymphatic alterations, shoulder range of motion, and scar complications. However, it does not specify whether these interventions translate into morbidities, only that they were studied for their effects on lymphatic function and related outcomes.",maybe
27495107,Does a negative nontreponemal and/or specific antitreponemal IgM test exclude active infectious syphilis : evidence from a rabbit infectivity test : A case report?,"The definitive differential diagnosis of active infectious syphilis should be reconsidered. Moreover, selecting the appropriate penicillin preparation is important because T pallidum can reside in sequestered sites. It is necessary to treat a patient with known invasion of the central nervous system with aqueous crystalline penicillin G, if previous treatment for syphilis failed and patients had some clinical neurological presentation that is otherwise unexplained, but that could represent neurosyphilis. Additional studies are needed to confirm the results in other syphilis patients.",no,"Maybe. The context indicates that negative nontreponemal and/or specific antitreponemal IgM tests are often used as evidence of being disease-free, but the diagnostic criteria for active infectious syphilis remain controversial. The rabbit infectivity test, which involves seronegative rabbits, was used to help confirm the presence of Treponema pallidum, suggesting that negative serological tests do not definitively exclude active infection.",maybe,"Maybe. The context indicates that the diagnostic criteria for active infectious syphilis are controversial and that clinicians often interpret negative nontreponemal and/or specific antitreponemal IgM tests as evidence of being disease-free. However, the mention of evidence from a rabbit infectivity test suggests that negative serologic tests may not definitively exclude active infectious syphilis, especially considering the complexity and debate surrounding diagnosis.",maybe
27516122,Is preoperative Statin Use at the Time of Radical Prostatectomy Associated With Biochemical Recurrence or Pathologic Upgrading?,Preoperative statin use at the time of radical prostatectomy was not associated with biochemical recurrence or risk of pathologic upgrading in this cohort. These data add to the existing body of literature suggesting that statin use is not associated with more favorable clinical outcomes following radical prostatectomy.,no,"Maybe. The study indicates that preoperative statin use was not associated with pathologic upgrading (adjusted odds ratio 0.78; 95% CI 0.58–1.04) or biochemical recurrence (adjusted hazard ratio 1.06; 95% CI 0.86–1.31), suggesting no significant association between preoperative statin therapy at the time of radical prostatectomy and these oncological outcomes.",maybe,"No, preoperative statin use at the time of radical prostatectomy is not associated with biochemical recurrence or pathologic upgrading. The study found that statin use was not associated with biochemical recurrence (adjusted hazard ratio 1.06; 95% CI 0.86 to 1.31) and was not associated with pathologic upgrading (adjusted odds ratio 0.78; 95% CI 0.58 to 1.04).",no
27496751,Does targeting factor VIII expression to platelets for hemophilia A gene therapy induce an apparent thrombotic risk in mice?,"Background Targeting factor (F) VIII expression to platelets is a promising gene therapy approach for hemophilia A, and is successful even in the presence of inhibitors. It is well known that platelets play important roles not only in hemostasis, but also in thrombosis and inflammation. Objective To evaluate whether platelet-FVIII expression might increase thrombotic risk and thereby compromise the safety of this approach. Methods In this study, platelet-FVIII-expressing transgenic mice were examined either in steady-state conditions or under prothrombotic conditions induced by inflammation or the FV Leiden mutation. Native whole blood thrombin generation assay, rotational thromboelastometry analysis and ferric chloride-induced vessel injury were used to evaluate the hemostatic properties. Various parameters associated with thrombosis risk, including D-dimer, thrombin-antithrombin complexes, fibrinogen, tissue fibrin deposition, platelet activation status and activatability, and platelet-leukocyte aggregates, were assessed. Results We generated a new line of transgenic mice that expressed 30-fold higher levels of platelet-expressed FVIII than are therapeutically required to restore hemostasis in hemophilic mice. Under both steady-state conditions and prothrombotic conditions induced by lipopolysaccharide-mediated inflammation or the FV Leiden mutation, supratherapeutic levels of platelet-expressed FVIII did not appear to be thrombogenic. Furthermore, FVIII-expressing platelets were neither hyperactivated nor hyperactivatable upon agonist activation. Conclusion We conclude that, in mice, more than 30-fold higher levels of platelet-expressed FVIII than are required for therapeutic efficacy in hemophilia A are not associated with a thrombotic predilection.",no,"Maybe. The context indicates that targeting factor VIII expression to platelets does not induce thrombosis and that studies show no increase in thrombotic risk when FVIII is appropriately targeted to platelets. However, since the study aims to evaluate whether this approach would increase the risk, the conclusion is not definitively established within the provided information.",maybe,"Yes, targeting factor VIII expression to platelets for hemophilia A gene therapy does not induce an apparent thrombotic risk in mice. The context indicates that platelet-specific FVIII expression does not elevate thrombosis risk, nor does it cause hyper-activation or hyper-responsiveness of platelets.",no
27493882,Is familiar Papillary Thyroid Carcinoma in a Large Brazilian Family Associated with Succinate Dehydrogenase Defects?,"Familiar PTC and a GIST were not associated with SDHx mutations; additional genetic defects, yet unknown, may be responsible for the development of tumor.",no,"Maybe. The context indicates that familial papillary thyroid cancer (PTC) in a large Brazilian family has been studied in relation to genetic variants in the sdhb gene, which have been implicated in the disease. However, it also mentions that the family was screened for variations in the sdha, sdhb, sdhc, and sdhd genes, but does not specify whether a definitive association with succinate dehydrogenase defects has been established.",maybe,"Yes, the study suggests an association between familial papillary thyroid cancer in a large Brazilian family and mutations in succinate dehydrogenase genes, specifically sdhb, sdhc, and sdhd. The study aimed to evaluate the relationship between variants in these genes and familial papillary thyroid cancer, indicating a potential link between SDH defects and the condition in this family.",yes
27514245,"States diet quality , risk factors and access to care among low-income uninsured American adults in states expanding Medicaid vs. expanding under the affordable care act?",Differences across states in Medicaid coverage under the ACA may lead to widening disparities in health outcomes between expanding and non-expanding states.,no,"Maybe. The information indicates that low-income uninsured residents in states that did not expand Medicaid have worse diet quality, as evidenced by lower healthy eating index scores (41.8 vs. 44.1, p=0.006), and higher prevalence of obesity (41% vs. 33%, p=0.007) compared to those in states that expanded Medicaid. Additionally, access to care is negatively impacted in non-expanding states. However, the prevalence of asthma was lower in non-expanding states (14.8% vs. 19.7%, p=0.037). Overall, diet quality and access to care are poorer in non-expanding states, while some health risk factors like obesity are higher, highlighting disparities based on Medicaid expansion status.",maybe,"Maybe. The context indicates that low-income uninsured residents in states that did not expand Medicaid had a lower healthy eating index score and higher obesity prevalence compared to those in states that did expand Medicaid, suggesting differences in diet quality. Additionally, the prevalence of asthma was higher in states that expanded Medicaid. These findings imply potential differences in risk factors and access to care, but specific details about overall access to care are not provided.",maybe
27491601,Is combined Use of Bivalirudin and Radial Access in Acute Coronary Syndromes Superior to the Use of Either One Separately : Meta-Analysis of Randomized Controlled Trials?,"Bivalirudin reduces bleeding risk only with femoral access, and radial access reduces bleeding risk only with heparin anticoagulation. Therefore, there is no additional benefit to the combined use of bivalirudin and radial access strategies in patients with ACS.",no,"Maybe. The meta-analysis indicates that the interaction between bivalirudin use and radial artery access, and their combined benefit, remains unclear. There were no significant differences in major adverse cardiovascular events or major bleeding when comparing strategies, and the specific combined effect of using both together was not definitively established.",maybe,"Maybe. The meta-analysis indicates that the interaction between bivalirudin use and radial artery access and their combined benefit are unclear. There were no significant differences in major adverse cardiovascular events or major bleeding reduction when using bivalirudin with radial access, suggesting that the superiority of their combined use over either strategy alone is not established based on the available data.",maybe
