pubmed_id,question,actual_answer,actual_result,answer_ordinary,result_ordinary,answer_no_inferred,result_no_inferred
26037986,30-Day and 1-year mortality in emergency general surgery laparotomies: an area of concern and need for improvement?,"Emergency laparotomy carries a high rate of mortality, especially in those over the age of 70 years, and more needs to be done to improve outcomes, particularly in this group. This could involve increasing acute surgical care manpower, early recognition of patients requiring emergency surgery, development of clear management protocols for such patients or perhaps even considering centralisation of emergency surgical services to specialist centres with multidisciplinary teams involving emergency surgeons and care of the elderly physicians in hospital and related community outreach services for post-discharge care.",maybe,"Yes, the context indicates that emergency laparotomies are associated with significant mortality concerns, with a 30-day mortality rate of approximately 14-15% and a 1-year mortality rate of 38%. Patients over 70 years have a higher 1-year mortality, highlighting the need for improvement in care and strategies to optimize outcomes in emergency general surgery laparotomies.",yes,"Yes, the context indicates that emergency laparotomies are associated with higher mortality rates, with recent studies suggesting a 30-day mortality rate between 14% and 15%. This highlights an area of concern and the need for improvement in care strategies.",yes
17940352,Does HER2 immunoreactivity provide prognostic information in locally advanced urothelial carcinoma patients receiving adjuvant M-VEC chemotherapy?,HER2 immunoreactivity might have a limited prognostic value for advanced urothelial carcinoma patients with adjuvant M-VEC.,maybe,"Yes, HER2 immunoreactivity provides prognostic information in locally advanced urothelial carcinoma patients receiving adjuvant M-VEC chemotherapy. The context indicates that HER2 immunoreactivity was a significant prognostic factor for progression-free survival (p=0.03) and disease-specific overall survival (p=0.02) in patients treated with adjuvant M-VEC chemotherapy, highlighting its relevance in predicting clinical outcomes in this group.",yes,"Yes, HER2 immunoreactivity provides prognostic information in locally advanced urothelial carcinoma patients receiving adjuvant M-VEC chemotherapy. It was a significant prognostic factor for both progression-free survival (p=0.03) and disease-specific overall survival (p=0.02) in these patients, according to univariate analysis.",yes
24183388,Is the Hawkins sign able to predict necrosis in fractures of the neck of the astragalus?,"A positive Hawkins sign rules out that the fractured talus has developed avascular necrosis, but its absence does not confirm it.",maybe,"No, the Hawkins sign is not able to predict necrosis in fractures of the neck of the astragalus. The context indicates that the study found no statistically significant differences when evaluating the Hawkins sign against the occurrence of avascular necrosis in such fractures.",no,"Yes, the Hawkins sign can predict necrosis in fractures of the neck of the astragalus. The study found a statistically significant difference (p = .03) when comparing the development of avascular necrosis with the presence of Hawkins sign, indicating its predictive value.",yes
14599616,Can a practicing surgeon detect early lymphedema reliably?,An increase of 5% in circumference measurements identified the most potential lymphedema cases compared with an academic trial.,maybe,"Maybe. The detection of lymphedema relies on established criteria with varying sensitivity, such as a 10% increase in circumference detecting approximately 74.4% of cases, and a 5% increase being more sensitive at 91%. Since sensitivity measures the ability to detect early cases, and the methods depend on these criteria, a practicing surgeon's ability to reliably detect early lymphedema is limited by the sensitivity of the detection criteria used.",maybe,"No, a practicing surgeon cannot reliably detect early lymphedema based solely on clinical examination. The context indicates that the sensitivity of clinical criteria such as limb circumference changes is limited (e.g., only 49% sensitivity for a 10% increase in limb volume), meaning many cases may be missed. Although some detection methods like a 5% increase in circumference are more sensitive (91%), the overall reliability of clinical detection by a surgeon alone is not sufficient for early lymphedema detection.",no
20082356,Should direct mesocolon invasion be included in T4 for the staging of gastric cancer?,Mesocolon invasion should be included in T4 for the staging of gastric cancer.,maybe,"Maybe. The context indicates that the mesocolon is significant for the curability and prognosis of gastric cancer, with worse outcomes associated with direct invasion into the mesocolon. However, the international union against cancer (UICC) does not mention the mesocolon as an involved site in gastric cancer staging, and there is no explicit guideline to include mesocolon invasion in T4. The study aims to characterize and classify mesocolon invasion, suggesting it may be an important factor, but current official staging guidelines do not specify its inclusion.",maybe,"No, direct mesocolon invasion should not be included in T4 for the staging of gastric cancer. The context indicates that the UICC does not mention the mesocolon as an adjacent structure involved in gastric cancer, and although mesocolon invasion is associated with worse outcomes compared to T3, it is not classified as T4 based on current staging guidelines.",no
26606599,Do Surrogates of Injury Severity Influence the Occurrence of Heterotopic Ossification in Fractures of the Acetabulum?,"Surrogates of injury severity, including days in the ICU and non-ICU hospital LOS>10 days, were associated with the development of HO in our cohort of acetabular fracture patients. Prophylaxis with XRT was significantly protective against the development of HO, and the ability to provide prophylaxis is very likely related to the severity of injury.",maybe,"Maybe. The study aimed to determine the relationship between injury severity surrogates and the development of heterotopic ossification following acetabular fracture treatment. However, the provided information indicates that there was no significant difference in heterotopic ossification rates between groups with different injury severity surrogates, specifically noting a p-value of .764 for Brooker classification greater than I. This suggests that injury severity surrogates may not influence the occurrence of heterotopic ossification in this context.",maybe,"No, surrogates of injury severity do not influence the occurrence of heterotopic ossification in fractures of the acetabulum. The study found no significant difference in heterotopic ossification rates, including more severe Brooker grades, between groups with different injury severity surrogates, as indicated by a p-value of .764.",no
25277731,Sternal fracture in growing children : A rare and often overlooked fracture?,Isolated sternal fractures in childhood are often due to typical age-related traumatic incidents. Ultrasonography is a useful diagnostic tool for fracture detection and radiography is the method of choice for visualization of the extent of the dislocation.,maybe,"Yes, sternal fractures in childhood are rare and often overlooked. The context indicates that sternal fractures in children are infrequent, with only four cases identified among inpatients and outpatients over a two-year period, and the study aimed to investigate their mechanisms, detection criteria, and associated injuries, highlighting their rarity and potential for being overlooked.",yes,"Yes, sternal fractures in childhood are rare and often overlooked. The context indicates that only a few children (a total of four) with sternal fractures were treated over two years, highlighting their rarity. Additionally, the study aimed to investigate detection criteria and associated injuries, suggesting that these fractures may not be immediately recognized or considered in children.",yes
18235194,Is a specialised training of phonological awareness indicated in every preschool child?,"A specialized training program to improve phonologic awareness as a basis for reading and writing in every kindergarten and preschool child seems to be unnecessary. However, children with temporary hearing deficits benefit from such a program. For all other children general perception training may be sufficient.",maybe,"No, a specialised training of phonological awareness is not indicated in every preschool child. The context indicates that children with a history of hearing loss, current hearing loss, or pathologic middle ear findings benefit most from such specialized training, suggesting it is targeted rather than universally necessary.",no,"Maybe. The context indicates that a specialized training for phonological awareness was provided to some preschool children to prevent dyslexia, but it does not specify that it is indicated for every preschool child. Therefore, it is not necessarily indicated for all preschool children.",maybe
22427593,"Are normally sighted, visually impaired, and blind pedestrians accurate and reliable at making street crossing decisions?","Our data suggested that visually impaired pedestrians can make accurate and reliable street crossing decisions like those of normally sighted pedestrians. When using auditory information only, all subjects significantly overestimated the vehicular gap time. Our finding that blind pedestrians performed significantly worse than either the normally sighted or visually impaired subjects under the hearing only condition suggested that they may benefit from training to improve their detection ability and/or interpretation of vehicular gap times.",maybe,"No, normally sighted and visually impaired pedestrians are not only accurate but also reliable at making street crossing decisions, whether using vision plus hearing or vision only. They demonstrated high accuracy and reliability in their decision-making. In contrast, blind pedestrians were the least accurate, especially under hearing-only conditions, though all groups were reliable in their decisions.",no,"No, normally sighted and visually impaired pedestrians are not necessarily accurate at making street crossing decisions when using only auditory information, as all subjects, including these groups, were found to be inaccurate under the hearing-only condition. However, they were reliable in their decisions under this condition. Blind pedestrians were less accurate than the other groups under hearing-only conditions, with statistically significant differences.",no
19694846,Does self-efficacy mediate the relationship between transformational leadership behaviours and healthcare workers' sleep quality?,"Our results indicate that training managers in transformational leadership behaviours may have a positive impact on healthcare workers' health over time. However, more research is needed to examine the mechanisms by which transformational leadership brings about improved sleep quality; self-efficacy was not found to be the explanation.",maybe,"No, self-efficacy does not mediate the relationship between transformational leadership behaviours and healthcare workers' sleep quality. The context indicates that the relationship between transformational leadership and sleep quality was not mediated by self-efficacy, and the direct effect of transformational leadership on sleep quality is not influenced by self-efficacy.",no,"No, self-efficacy does not mediate the relationship between transformational leadership behaviours and healthcare workers' sleep quality. The context indicates that the relationship between transformational leadership and sleep quality was not mediated by employees' self-efficacy.",no
27184293,Does microbial contamination influence the success of the hematopoietic cell transplantation outcomes?,"The use of contaminated products with antibiotic prophylaxis may be safe in terms of the first day of fever, duration of fever, neutrophil, platelet engraftment and duration of hospitalization.",maybe,"Yes, microbial contamination influences the success of hematopoietic cell transplantation outcomes. The context indicates that microbial contamination can significantly affect transplant success, with contaminated grafts associated with complications such as febrile neutropenic attacks, and contamination rates being a key factor in evaluating transplant safety and outcomes.",yes,"Maybe. The context indicates that microbial contamination is considered an important factor in the collection and infusion process and that a significant number of patients with contaminated grafts experienced febrile neutropenic attacks. However, none of the patients who received contaminated products died within 30 days post-transplantation, suggesting that contamination may not directly influence overall transplantation success in terms of mortality within this period.",maybe
16968876,Is a patient's self-reported health-related quality of life a prognostic factor for survival in non-small-cell lung cancer patients?,The results suggest that patients' self-reported HRQOL provide independent prognostic information for survival. This finding supports the collection of such data in routine clinical practice.,maybe,"Yes, a patient's self-reported health-related quality of life (HRQoL) is a prognostic factor for survival in non-small-cell lung cancer patients. The context indicates that the performance status, which contributes to understanding HRQoL, is a significant prognostic factor that helps clarify the aspects of HRQoL affecting survival. Additionally, pretreatment HRQoL was measured and analyzed to determine its independent prognostic value, and the patient's self-reported score of pain offers valuable prognostic information regarding survival outcomes. The Cox proportional hazards regression model was used to investigate whether HRQoL provides independent prognostic information for survival, supporting its role as a prognostic factor.",yes,"Yes, a patient's self-reported health-related quality of life provides independent prognostic information for survival in non-small cell lung cancer patients. The study aimed to investigate this potential and found that pretreatment health-related quality of life was assessed as a prognostic factor, indicating its relevance in predicting survival outcomes.",yes
16816043,Do French lay people and health professionals find it acceptable to breach confidentiality to protect a patient's wife from a sexually transmitted disease?,Most people in France are influenced by situational factors when deciding if a physician should breach confidentiality to protect the spouse of a patient infected with STD.,maybe,"Yes, lay people find it acceptable to breach confidentiality to protect a patient's wife from a sexually transmitted disease. The context indicates that lay people generally consider it acceptable for a physician to breach confidentiality in order to protect loved ones, especially when the patient intends to inform or protect their spouse, reflecting a moral duty to do so.",yes,"Maybe. The context indicates that lay people and psychologists find breaching confidentiality to protect a patient's wife more acceptable than physicians do, but it does not specify whether they find it acceptable in all circumstances. The acceptability is influenced by the patient's intentions to protect and inform his wife, suggesting that it depends on specific conditions.",maybe
10223070,Is perforation of the appendix a risk factor for tubal infertility and ectopic pregnancy?,"The methodologic weaknesses of the studies do not permit acceptance of increased risk of tubal pregnancy or infertility as a consequence of perforation of the appendix, so a causal relationship cannot be supported by the data currently available. Only a well-designed case-control study with unbiased ascertainment of exposure and adjustment for confounding variables will provide a definitive answer.",maybe,"Yes, perforation of the appendix is a risk factor for tubal infertility and ectopic pregnancy. The evidence indicates a significant association, with a risk estimate of 4.8 (95% CI 1.5 to 14.9) for tubal infertility resulting from perforation, supported by multiple studies. Additionally, perforation is associated with an increased risk of ectopic pregnancy, with an estimate of 1.6 (95% CI 1.1 to 2.5).",yes,"Yes, perforation of the appendix is considered a risk factor for tubal infertility and ectopic pregnancy. The review of the literature indicates that perforation is associated with increased risks, with estimates ranging from 1.6 for ectopic pregnancy and up to 4.8 for tubal infertility, suggesting a potential link between appendiceal perforation and adverse fertility outcomes.",yes
18243752,Should chest wall irradiation be included after mastectomy and negative node breast cancer?,Post-mastectomy radiotherapy should be discussed for a sub-group of node-negative patients with predictors factors of local failure such as age<or = 40 years and larger tumour size.,maybe,"Maybe. The context indicates that patients with node-negative breast cancer treated with mastectomy received post-mastectomy radiotherapy that included only the internal mammary chain, and the study evaluated local failure patterns in such cases. However, it does not explicitly state whether chest wall irradiation should be included or omitted in this setting, only that the focus was on radiotherapy targeting the internal mammary chain.",maybe,"No, based on the provided context, the study involved patients with node-negative breast cancer treated with post-mastectomy radiotherapy including only the internal mammary chain, suggesting that chest wall irradiation was not included in this specific treatment approach.",no
1571683,Storage of vaccines in the community: weak link in the cold chain?,"Vaccines were exposed to temperatures that may reduce their potency. Safe storage of vaccines in the clinics cannot be ensured without adhering to the recommended guidelines. Provision of adequate equipment and training for staff in maintaining the ""cold chain"" and the use and care of equipment are important components of a successful immunisation programme.",maybe,"Maybe. The context indicates that many general practices and child health clinics face challenges in maintaining proper vaccine storage conditions, with some vaccines exposed to subzero temperatures or temperatures up to 16°C, which suggests that storage in the community is a weak link in the cold chain.",maybe,"Yes, storage of vaccines in the community appears to be a weak link in the cold chain. The context indicates that only a minority of practices were aware of proper storage conditions, and monitoring revealed that vaccines were exposed to inappropriate temperatures, including subzero and up to 16°C, which suggests inadequate storage practices in the community setting.",yes
22211919,"Actinobaculum schaalii, a cause of urinary tract infections in children?","Actinobaculum schaalii is CO(2)-dependent. Therefore, if there are clinical symptoms and/or a negative culture despite the presence of leucocytes in the urine, Gram staining and incubation in 5% CO(2) or species-specific real-time PCR should be performed to identify A. schaalii.",maybe,"Yes, actinobaculum schaalii can be a cause of urinary tract infections in children. The context indicates that it was found in children with urinary tract infections, associated with large numbers of leukocytes in urine, and present in significant quantities (at least 10^4 to 10^6 cfu/ml), suggesting a pathogenic role in these infections.",yes,"Yes, actinobaculum schaalii can be a cause of urinary tract infections in children. The context indicates that it was found in children with urinary tract infections, with significant bacterial quantities detected by culture and PCR, supporting its role as a pathogen in these cases.",yes
20871246,"Young-Burgess classification of pelvic ring fractures: does it predict mortality, transfusion requirements, and non-orthopaedic injuries?","The Young-Burgess system is useful for predicting transfusion requirements. For the system to predict mortality or nonorthopaedic injuries, fractures must be divided into stable (APC1, LC1) and unstable (APC2, APC3, LC2, LC3, VS, combined mechanism of injury) types. LC1 injuries are very common and not always benign (overall mortality rate, 8.2%).",maybe,"Maybe. The Young-Burgess classification system predicts mortality, transfusion requirements, and non-orthopaedic injuries in patients with pelvic ring fractures, as it has been evaluated for its ability to predict these outcomes and differentiates fracture types associated with higher transfusion needs and injury rates.",maybe,"Yes, the Young-Burgess classification of pelvic ring fractures predicts mortality, transfusion requirements, and non-orthopaedic injuries. The study's objectives included evaluating its ability to predict these outcomes, and the main outcome measurements focused on mortality, transfusion needs, and non-orthopaedic injuries as functions of the classification type. Additionally, dividing fractures into stable and unstable types within this system allowed for predictions of mortality, transfusion requirements, and abdomen injury rates.",yes
12805495,Can patients be anticoagulated after intracerebral hemorrhage?,"Survivors of lobar ICH with atrial fibrillation should not be offered long-term anticoagulation. Similarly, most patients with deep hemispheric ICH and atrial fibrillation should not receive anticoagulant therapy. However, patients with deep hemispheric ICH at particularly high risk for thromboembolic stroke or low risk of ICH recurrence might benefit from long-term anticoagulation.",maybe,"No, patients with a history of intracerebral hemorrhage are generally not anticoagulated, as withholding anticoagulation therapy is strongly preferred in these cases due to the increased risks associated with anticoagulation, especially with warfarin.",no,"No, patients should generally not be anticoagulated after intracerebral hemorrhage, especially in cases of prior lobar ICH, as withholding anticoagulation was strongly preferred and associated with better outcomes.",no
11458136,Does managed care enable more low income persons to identify a usual source of care?,"Having a usual physician can be an effective tool in improving access to care for low-income populations, although it is most effective when combined with insurance coverage. However, the effectiveness of managed care in linking more low-income persons to a medical home is uncertain, and may have unintended consequences for uninsured persons.",maybe,"Maybe. The context indicates that managed care programs aim to improve access to care for low-income individuals and encourage the use of a usual source of care. However, it also notes that managed care has only marginal effects on the likelihood of having a usual source of care among low-income persons, and high managed care penetration is associated with a lower probability of uninsured individuals having a usual source of care. Therefore, while managed care programs are designed to facilitate access, the evidence suggests only a limited or mixed impact on enabling low-income persons to identify a usual source of care.",maybe,"No, managed care does not enable more low-income persons to identify a usual source of care. The context indicates that high managed care penetration in the community is associated with a lower likelihood of uninsured persons having a usual source of care, suggesting that managed care does not improve access for low-income individuals in this regard.",no
11867487,Does rugby headgear prevent concussion?,"Although most players in the study believe that rugby headgear may prevent concussion, only a minority reported wearing it. Coaches tended to be less convinced than the players that rugby headgear can prevent concussion.",maybe,"No, rugby headgear does not prevent concussion. Although many players believe it offers protection against concussion, the context indicates that this belief is not supported by evidence, and the focus is on attitudes rather than proven effectiveness.",no,"Maybe. The context indicates that a significant proportion of players and coaches believe protective headgear could prevent concussion, but it does not provide conclusive evidence that headgear actually prevents concussion.",maybe
